design	65d1a898b9a124b57111f330d544682	https://tinhte.vn/threads/moi-xem-y-tuong-thiet-ke-ios-moi-ket-hop-widget-cua-android-voi-live-tile-tren-wp.2306888/	"Khi giới thiệu iOS 7, Apple đã mang lại một giao diện mới hoàn toàn cho nền tảng di động của mình với các biểu tượng phẳng hơn, sắc nét hơn, font chữ mảnh hơn, tuy nhiên những tính năng tổng quan thì không có nhiều điểm khác biệt so với iOS 6. Có thể nó làm cho những người dùng iOS lâu năm cảm thấy thoải mái, nhưng những người dùng mới đến từ những hệ điều hành di động khác thì sẽ cảm thấy ""tù túng"" vì thiếu đi một số tính năng mà họ có thể thoải mái thực hiện trên Android hay Windows Phone. Nhà thiết kế trải nghiệm người dùng Jay Machalani nghĩ rằng anh có câu trả lời cho việc này và anh đã mượn ý tưởng của Google, Microsoft để làm điều đó.\n\nÝ tưởng của Machalani cơ bản sẽ đưa hệ thống widget phong phú của Android với thiết kế và tính năng của các ô Live Tile lên iOS. Một sự dung hòa giữa ba hệ điều hành di động phổ biến nhất hiện nay. Anh gọi sản phẩm của mình với cái tên ""iOS Block"". Nó cũng là một phương thức đơn giản để giúp chuyển đổi các biểu tượng ứng dụng ngoài màn hình chính trở thành những khối (block) có khả năng tương tác. Machalani cho biết: ""bạn có thể tương tác với Block và thật sự làm nhiều thứ với nó. Nhưng, bạn cũng có thể truy cập ứng dụng trực tiếp từ Block bởi nó chính là app, không phải là một thực thể riêng biệt"".\n\n\n \n \n  \n \nMột số Block dùng trong ý tưởng của Machalani​\nVậy để biến một icon thành Block thì sao? Rất đơn giản, Machalani gợi ý rằng người dùng có thể đặt hai ngón tay lên trên biểu tượng rồi vuốt hướng ra ngoài, giống như thao tác zoom ảnh/trang web. Khi đó, app sẽ chuyển thành một khối với thông tin thời tiết chi tiết, các sự kiện lịch, nút điều khiển việc chơi nhạc... Còn nếu muốn đưa nó ngược trở lại thành icon thì chỉ cần dùng hai ngón tay và vuốt hướng vào nhau. Tất nhiên, người dùng vẫn có thể cho phép các Block hiển thị mãi mãi trên màn hình bên cạnh các icon khác.\n\nThay vì thiết kế lại hoàn toàn homescreen của iOS với một giao diện không quan thuộc, nhà thiết kế 20 tuổi chỉ chỉnh sửa nó một chút và cung cấp thêm các tùy chọn màu để cá nhân hóa máy cho đẹp hơn. Đây cũng là một thứ rất hợp lý để Apple đưa vào sản phẩm thật sự của mình bởi hãng luôn đề cao trải nghiệm của người dùng.\n\nNếu lần đầu nhìn vào thiết kế ý tưởng của Machalani thì có thể bạn sẽ tưởng rằng đây chính là những hình ảnh rò rỉ từ iOS 8. Anh đã tạo ra ba nguyên mẫu thiết kế dành cho iPhone, iPad xoay dọc và iPad xoay ngang. Mời các bạn cùng xem qua.\n\n\n\n\n \n \n  \n \nBlock chơi nhạc cho phép bạn kiểm soát mọi thứ trên màn hình chính\n\n\n \n \n  \n\nMỗi một iOS Block sẽ có ba kích thước khác nhau để người dùng tùy chọn, tất cả đều có một icon (chấm tròn đen), một vùng điều khiển (đánh dấu caro) và vùng hiển thị nội dung hoặc đối tượng tương tác (đánh dấu gạch sọc) \n\n\n \n \n  \n \nKết quả cuối cùng sẽ là các block như thế này\n\n\n \n \n  \n\nĐây là ảnh chụp màn hình ý tưởng trên iPhone\n\n\n \n \n  \n \nĐây là trên iPad xoay ngang\n\n\n \n \n  \n\nVà trên iPad xoay dọc\n\n\n \n \n  \n\nVậy nếu mang lên thiết bị thực thì sao?\n\n\n \n \n  \n \n\n\n \n \n  \n​\n\n\n       "
design	1268b7378ab688873496d1ddad1cf49	https://tinhte.vn/threads/mot-so-diem-can-luu-y-khi-thiet-ke-icon-ung-dung-cho-ios-7.2159971/	"​ \nSo với iOS 6, bản nâng cấp iOS 7 chứng kiến một sự lột xác hoàn toàn về thiết kế icon cũng như giao diện bên trong các ứng dụng. Điều này đòi hỏi các lập trình viên cần phải khẩn trương đưa ra những thay đổi đối với các app của mình, giúp chúng trông phẳng hơn và đơn giản hơn. Về cơ bản thì từng app trên iOS 7 đều có nhiều thay đổi như kích thước icon khác nhau, các thành phần bên trong như dấu mũi tên, nút back hay các nút chức năng cũng đều được đơn giản hoá và phẳng hoá. Tuy nhiên, cụ thể những sự thay đổi này ra sao, một lập trình viên vừa qua đã chia sẻ một số điều giúp các developer dễ dàng hơn trong việc thiết kế lại app sao cho phù hợp với iOS 7.\n \nBạn nào là developer hay có hứng thú trong việc thiết kế icon app dành cho iOS 7 có thể tham khảo bài của anh chàng này để thuận lợi hơn trong công việc. Bài của anh này sẽ được liên tục cập nhật khi có thông tin mới.\n \nCác bước lập trình viên cần ghi nhớ để thiết kế giao diện app cho iOS 7.\n \n1. Độ phân giải màn hình của từng máy khi ở chế độ đứng, và ở chế độ nằm ngang.\n \n \n \n \n  \n ​ \n2. Mật độ điểm ảnh, chế độ màu, nhiệt độ màu\n \n\n \n \n  \n ​ \n3. Kích thước của icon\n \n\n \n \n  \n ​ \nKích thước của từng icon và ngôn ngữ thiết kế của chúng chính là những thay đổi rất dễ nhận ra kể trên iOS 7. Để rõ hơn mời các bạn xem bảng ở trên\n \n4. Những góc bo tròn.\n \n \n \n \n  \n​ \nVới các icon mới trên iOS 7, những giá trị, thông số về các góc bo tròn cũng sẽ khác hoàn toàn. Nếu để ý các bạn sẽ thấy những icon của các app trên iOS 7 dường như tròn trịa hơn - khá giống với icon trên Meego. Để dễ hình dung hơn nữa, hãy nhìn sự thay đổi của icon ở phía trên, các góc cạnh của icon được bo nhẹ nhàng, không còn vuông vức.\n \nThực tế, Apple không nói rõ về phần này, tuy nhiên, tác giả bài viết đã ngồi nghiên cứu và phát hoạ ra bản mẫu gần chính xác nhất. Các dev có thể tham khảo.\n \n5. Hệ thống dạng lưới\n \n\n \n \n  \n ​ \nĐây chính là điểm mà Apple nhấn mạnh nhất ở icon của iOS 7. Điều họ muốn thể hiện qua hệ thống dạng lưới này chính là tỷ lệ vàng - một tỷ lệ hoàn hảo mà những developer khác nên áp dụng vào việc thiết kế icon app. Apple muốn tất cả biểu tượng, từng vị trí nhỏ nhất cũng phải tuân theo tiêu chuẩn này, mọi thứ phải ngay ngắn và phải được ""đưa vào khuôn mẫu"". Thế nhưng, chính vì sự nghiêm ngặt có phần thái quá này, nhiều developer đã không đồng ý bởi họ muốn phá cách hơn và muốn được tự do trong thiết kế.\n \nTóm lại, các bạn có thể tự do thiết kế icon của app tuy nhiên, chúng ta cũng nên tuân thủ các tiêu chuẩn do Apple đặt ra để tránh rắc rối.\n \n6. Giao diện người dùng\n \n\n \n \n  \n ​ \nTiếp đến là độ cao, bề ngang của các thanh điều hướng, thanh status trên iOS 7. Các bạn tham khảo bảng ở trên.\n \n7. Thanh trạng thái (Status Bar)\n \n\n \n \n  \n ​ \nĐây là nơi hiển thị trạng thái của máy như pin, đồng hồ, cột sóng,...Thực tế thì kích thước của từng biểu tượng, font chữ trên Status Bar của iOS 7 giống với iOS 6, do đó các dev cũng không gặp quá nhiều khó khăn về phần này.\n \n8. Thanh điều hướng (Navigation Bar).\n \n\n \n \n  \n ​ \nThanh điều hướng trên iOS thường bao gồm tiêu đề, các nút back, next, edit hay create. Ở iOS 7, kích thước và font chữ trên thanh này khác so với iOS 6, cụ thể ra sao các bạn hãy nhìn phía trên.\n \n9. Kích thước khuôn khổ\n \n \n \n \n  \n ​ \nList hay khuôn khổ hay bảng hiển thị nội dung trên iOS 7 giờ đây đã được trải dài ra bằng với độ rộng của màn hình máy. Bên cạnh đó, mỗi dòng hay mỗi khu vực sẽ được ngăn cách bởi một đường thẳng 1px, có mép bên trái 15pt. Rõ hơn nữa thì mời các bạn xem hình trên.\n \n10. Màu sắc các icon mặc định\n \n\n \n \n  \n ​ \nCác icon mặc định trên iOS 7 trông rất đơn giản, rất phẳng, và nhìn nó không khác gì những nét vẽ tay. Đây chính là điểm mà Ive cùng đội ngũ thiết kế hướng đến: đơn giản hoá mọi thứ. Về cơ bản, chúng chỉ có màu đen và trắng, khi chọn vào, nó sẽ chuyển qua màu cam (thử mở Calendar và Clock các bạn sẽ thấy).\n \n11. Kiểu chữ\n \n\n \n \n  \n ​ \nHelvetica Neue vẫn là font chữ mặc định trên iOS 7, tuy nhiên các chữ trên iOS 7 giờ đây được thiết kế theo dạng Light, thay vì Regular hay Bold như các phiên bản trước đó. Đối với chữ trên các tiêu đề, chúng nên đưa về dạng Medium. Ngoài ra, các chữ điều hướng (như Select, Create, Next hay Edit) nên có màu xanh cho hài hoà và đồng bộ. Các dev cũng nên tăng kích thước của các chữ lên khi thiết kế app cho iOS 7.\n \nCó nhiều font chữ khác, ngoài Helvetica Neue, mà các dev có thể tận dụng, cụ thể hơn ở đây.\n \nTheo ivomynttinen​\n\n\n       "
design	2812d565fbd091afe1aec45a343aef6	https://tinhte.vn/threads/muon-kieu-gia-do-tu-thiet-ke-cho-iphone-ipod.221984/	"Chắc hẳn khi các mọi người mua Ipod touch gen 1,trong phụ kiện đi kèm có theo một cái giá đỡ để Ipod touch lên bàn xem phim dễ,nhưng sau này theo em biết thì lúc mua iphone và ipod touch gen 2 thì đều không có nó nữa!Vì thiếu đi cái này đôi khi cũng gây ra 1 chút phiền toái,nhưng vì thế cũng khiên có nhiều phát minh giá đỡ cho ipod và iphone rất đơn giản và độc đáo này!\n1.Giá đỡ từ thẻ điện thoại\n\n\n\n2.Từ hộp đựng đĩa CD\n\n3.Từ cây cạo râu!:rolleyes5cz:\n[ame=""http://www.youtube.com/watch?v=WqdNyI3xZWQ&feature=player_embedded""]http://www.youtube.com/watch?v=WqdNyI3xZWQ&[/ame]\n4.Độc đáo hơn nữa từ bút chì:confused1bb:\n\n5.Từ đĩa CD!\n[ame=""http://www.youtube.com/watch?v=in6fYul5pew&feature=player_embedded""]YouTube - Подставка для iPhone за 3 минуты[/ame]\n6.Thậm chí từ giấy!\n\n7.Từ vỏ có sẵn của Iphone và kẹp!\n\n\n8.Cái này cũng hay chả kém nè!\n[ame=""http://www.youtube.com/watch?v=nmgTKDrheYs&feature=player_embedded""]YouTube - iPhone Paper Clip Stand[/ame]\n9.Tu kính mắt!\n\nĐầy là một số mẫu em tìm kiếm được ở site iphones.ru !bác nào có thêm mẫu nào hay hay share mọi người với nhé!\n\n\n       "
design	d725951a194070a1e552893c6005fbc	https://tinhte.vn/threads/nha-thiet-ke-marc-newson-ve-lam-cho-apple-cung-doi-voi-jony-ive.2354247/	​\nThông tin từ tờ Vanity Fair cho biết Apple đã mời được nhà thiết kế công nghiệp nổi tiếng Marc Newson về làm việc cho đội ngũ thiết kế do Jony Ive đứng đầu. Marc Newson nổi tiếng là nhà thiết kế độc lập từng hợp tác với nhiều tên tuổi lớn như Ford, Nike, Qantas Airways... để cho ra đời những sản phẩm độc đáo. Lĩnh vực mà ông hoạt động cũng rất phong phú, từ quần áo, giày dép, đồng hồ, thuyền, nhà hàng hay thậm chí là thiết kế khoang cabin cho tàu không gian hay máy bay dân dụng.\n\nDù Apple chưa chính thức xác nhận thông tin này xong nguồn tin cho biết sau khi về làm cho Apple, Marc Newson sẽ vẫn ở lại Anh quốc, nơi ông cho ra đời nhiều dự án thiết kế công nghiệp tạo nên tên tuổi cho ông, thay vì về trụ sở ở Cupertino. Ông cũng sẽ kết hợp đi lại giữa Anh và Mỹ khi cần làm việc nhóm với đội ngũ Apple. Khi về với Apple, Marc Newson và Jony Ive được kỳ vọng sẽ tạo ra nhiều thứ hấp dẫn hơn cho Apple. Sở dĩ, hai nhà thiết kế nổi tiếng này đã từng làm việc trên nhiều dự án trước đây, đơn cử như chiếc Mac Pro RED cho mục đích từ thiện năm ngoái hay tai nghe EarPod màu vàng 18 carat. Ngoài công việc, Marc Newson và Jony Ive còn là bạn thân của nhau trong cuộc sống vài năm trở lại đây. Bên dưới là hình ảnh một số tác phẩm ra đời dưới bàn tay thiết kế thiên tài của Marc Newson.\n\n\n \n \n  \n \nXe ý tưởng 021C cho Ford Ghia với cửa mở đối xứng\n\n\n \n \n  \n \nBồn tắm Caroma mang về giải thiết kế tốt 2014 cho Newson\n\n\n \n \n  \n \nGhế Embryo thiết kế cho hãng Cappellini năm 1988\n\n\n \n \n  \n\nMáy bay ý tưởng Kelvin40 năm 2004\n\n\n \n \n  \n \nĐồng hồ Pod cuối những năm 80 cho nhà sản xuất đồng hồ Ikepod\n\n\n \n \n  \n \nGiường ngủ cho hãng hàng không Qantas. Giường ngủ này được gọi là SkyBed, nó cũng giúp ông dành giải thưởng về thiết kế\n\n\n \n \n  \n \nLọ nước hoa cho Shiseido\n​\nNguồn: Vanity Fair, Cult of Mac​\n\n\n       
design	2df41f7b8cf945392363ee3166cae97	https://tinhte.vn/threads/nhan-chung-chuyen-gia-75-dap-vien-lien-tuong-thiet-ke-ipad-voi-apple.1432562/	"​ \nMột nhân chứng chuyên gia đã được Apple mời ra trước tòa ngày hôm qua để trình bày kết quả khảo sát liên quan đến mức độ liên tưởng giữa thiết kế iPhone và iPad và thương hiệu Apple của người tiêu dùng. Hal Poret, một nhà nghiên cứu làm việc tại ORC Internetional, cung cấp cho tòa kết quả nhiều nghiên cứu được ông tiến hành trên các thiết bị riêng lẻ. Hal sử dụng 2 hình ảnh iPad 2 được chụp thẳng mặt và chụp nghiêng, với màn hình chính được làm mờ. Ông sử dụng 2 máy tính bảng khác không phải iPad, cũng được làm mờ màn hình chính, để làm nhóm kiểm soát cho nghiên cứu.\n \nSau đó, Hal tiến hành hỏi đáp viên hãy nhìn vào 2 tấm hình và cho biết họ liên tưởng những hình ảnh này đến công ty nào. 57,3% đáp viên liên tưởng tấm hình thứ nhất (chụp thẳng) đến Apple, trong khi đó tấm chụp nghiêng được đến 75,2% đáp viên liên tưởng tới Apple. Khi trừ đi số lượng đáp viên chọn sản phẩm thuộc nhóm kiểm soát, kết quả cuối cùng lần lượt là 40,3% và 64,4%.\n \nMột khảo sát tương tự cũng được thực hiện với sản phẩm iPhone 3GS. Hal chuẩn bị 2 hình ảnh, 1 iPhone với vòng bezel viền màn hình và 1 tấm khác không có vòng bezel - cả 2 đều được làm mờ màn hình home. BlackBerry Storm và Sanyo Zio được dùng làm thiết bị kiểm soát. Trong nghiên cứu này, 69% đáp viên liên tưởng tấm hình thứ nhất (có vòng bezel) với Apple, và 61% đối với hình thứ 2. Kết quả sau khi đã trừ nhóm kiểm soát lần lượt là 64,3% và 57,3%.\n \nNghiên cứu của Hal nhằm mục đích định lượng nhận thức của người dùng. ""Có thể hiểu nó như thế này: người dùng có biết về kiểu dáng của iPhone, vì chỉ cần nhìn là họ có thể biết được sản phẩm đấy có phải là iPhone hay không"". Điểm này rất quan trọng trong lập luận chung của Apple, rằng bề ngoài và thiết kế của iPhone và iPad chiếm phần lớn ""thị phần nhận thức"" của khách hàng, và giá trị này đang bị các sản phẩm của Samsung làm cho suy giảm.\n \nTuy nhiên, trong phần tranh luận, luật sư của Samsung Bill Price đã chỉ ra rằng nghiên cứu của Hal không cho thấy khách hàng bị nhầm lẫn giữa sản phẩm của Apple và Samsung. Bên cạnh đó, trong tấm hình iPad 2 chụp nghiêng - tấm hình nhận được kết quả liên tưởng cao nhất, phím home đã không được làm mờ, trong khi tấm hình có làm mờ thì kết quả thấp hơn.\n \nSau đó, Bill tiếp tục tranh luận với Hal về độ tin cậy của nghiên cứu, nhận định rằng việc trình bày dữ liệu của ông không tập trung đúng vào nhóm đối tượng người dùng, đồng thời nó cũng không tuân thủ đúng trình tự thời gian. Bill đề xuất những thay đổi về phương pháp và cách phân tích dữ liệu nhằm khắc phục lỗi thứ nhất, và khi đó tỷ lệ phần trăm liên tưởng sẽ giảm đi rất nhiều. Hal gọi những kết luận của Bill là bừa bãi và duy ý chí, thậm chí nói thẳng với vị luật sư ""tôi thấy rằng anh đang có sự bối rối và nhầm lẫn đấy"".\n \n""Tốt thôi"", Bill trả lời. ""Nhưng cho phép tôi kết thúc phần chất vấn của mình, rồi sau đấy chúng ta có thể đi uống với nhau và anh nói cho tôi biết tôi đã nhầm lẫn thế nào nhé"".\n \nNguồn: The Verge​\n\n\n       "
design	80eb86c81d048abf95d660e880dab01	https://tinhte.vn/threads/nhieu-kha-nang-apple-se-chuyen-sang-thiet-ke-toan-kinh-vao-nam-2017-iphone-7s.2571398/	Thông tin từ nhà phân tích Ming-Chi Kuo của KGI cho biết Apple nhận thấy nhôm không còn được coi là một vật liệu hiện đại và cao cấp trong năm 2017 nữa nên nhiều khả năng họ sẽ chuyển sang một thiết kế toàn kính. 2016 là năm của iPhone 7 còn 2017 là năm của bản cập nhật nhẹ iPhone 7s theo như thông lệ từ trước đến nay. Nếu đây là sự thật thì đây sẽ là một bất ngờ rất lớn khi Apple thay đổi lịch trình nâng cấp sản phẩm của họ.\n\nHiện tại người ta chưa biết làm cách nào Apple có thể tạo ra một chiếc iPhone toàn kính. Họ từng sử dụng thiết kế kính 2 mặt trên chiếc iPhone 4/4s nhưng ở giữa là khung kim loại. Nhiều khả năng iPhone 7s cũng sẽ sử dụng màn hình OLED khi mà Apple được cho đã ký với Samsung một hợp động trị giá 2.6 tỷ đô la Mỹ vào tuần trước.\n\n*Ảnh minh họa\n\nTham khảo: 9to5Mac​\n\n\n       
