design	789dc10ad2fd023e7173a44610fc376	https://tinhte.vn/threads/day-co-phai-la-giao-dien-phang-tren-ios-7-hay-khong.2113157/	"​ \nMột hình chụp mới rò rỉ gần đây cho thấy giao diện màn hình chính của một iPhone khá lạ so với phiên bản iOS 6 hiện tại, nhiều người cho rằng đây là kiểu thiết kế phẳng mà Apple muốn áp dụng trên iOS 7. Dù chưa có cơ sở nào để tin rằng đây là giao diện của iOS 7 vì hình ảnh khá mờ và không rõ nét cho lắm nhưng nó cho thấy giao diện đã ""phẳng"" hơn so với phiên bản hệ điều hành hiện tại. Không có nhiều thay đổi được Apple áp dụng đối với các biểu tượng ứng dụng (icon) nhưng nó đã bớt phức tạp hơn, hiệu ứng kính có thể đã bị loại bỏ. Dựa vào hình ảnh rò rỉ này mà iDownloadBlog đã tạo ra một hình khác để chúng ta thấy rõ sự thay đổi.\n \nDựa vào hình ảnh mà nguồn tin tạo ra có thể thấy một lớp kính trên các biểu tượng như Safari, Music, Phone, Messages, App Store... đã bị loại bỏ để bỏ đi hiệu ứng ba chiều vốn có trên iOS trong nhiều năm nay. Điều này cũng khá hợp lý nếu gắn nó với những tin đồn gần đây về iOS 7 mà Jony Ive thiết kế. Theo tin đồn thì iOS 7 sẽ là phiên bản iOS có sự thay đổi lớn về giao diện khi Apple muốn ứng dụng kiểu thiết kế phẳng.\n \n\n \n \n  \n​ \nHình ảnh bên trên được tạo ra để mô ta sự thay đổi trong khâu thiết kế một biểu tượng chương trình trên iOS 7. Biểu tượng chương trình ở trên iOS 6 trở về trước hầu hết bao gồm 4 lớp chính gồm lớp đổ bóng (Shadow Layer), lớp biểu tượng chính (Main Icon), lớp kính (Gloss Layer) và lớp mặt nạ (Mask Layer) nhưng trên iOS 7 thì có thể lớp kính sẽ bị loại bỏ để không còn hiệu ứng ba chiều nữa. Ngoài ra, biểu tượng ứng dụng thời tiết cũng đã loại bỏ con số 73 độ K mà chỉ còn hình ảnh mặt trời trên nền xanh. Cùng với thiết kế phẳng, phong cách thiết kế kiểu mô phỏng (skeuomorphic) được cho cũng sẽ biến mất trên iOS 7. Skeuomorphic là kiểu thiết kế mô phỏng những gì ngoài đời thực, ví dụ bên trong ứng dụng iBooks sẽ giống như một quyển sách với cách lật trang, đường chỉ, màu da...\n \nHình ảnh chụp bên trên mới chỉ là hình ảnh đầu tiên được cho là của iOS 7 xuất hiện vì thế độ chính xác của nó chưa được kiểm nghiệm cũng như những gì mà ta biết về iOS 7 vẫn còn rất ít. Apple sẽ chính thức nói về phiên bản hoàn toàn mới này tại sự kiện WWDC sẽ khai mạc vào ngày 10/6 tới.\n \n\n \n \n  \n​ \nNguồn: Apple Insider​\n\n\n       "
design	b487dda02e848675f745bfc73676218	https://tinhte.vn/threads/day-co-phai-la-iphone-6c-man-hinh-4.2443797/	"Sự khác biệt về lỗ loa/micro của iPhone 5c và iPhone 6c khá rõ ràng: iPhone 5c (trái) chỉ có một hàng, trong khi iPhone 6c thì có đến hai hàng​\nApple đã không làm mới iPhone 5c khi hãng ra mắt iPhone 6 và 6 Plus, tuy nhiên theo trang Future Supplier thì nhiều khả năng hãng sẽ cập nhật dòng smartphone trung cấp này với chiếc ""iPhone 6c"". Trong ảnh rò rỉ chụp bộ vỏ sản phẩm, bạn có thể thấy rằng iPhone 6c đã chuyển sang dùng đèn flash LED kép thay vì flash đơn như iPhone 5c. Lỗ loa và micro của máy cũng biến thành hai hàng thay vì chỉ một hàng như người tiền nhiệm. Kích thước màn hình 4"" và những tùy chọn màu trẻ trung vẫn sẽ tiếp tục được Apple duy trì, trong ảnh rò rỉ chúng ta thấy phiên bản màu hồng của iPhone 6c. Có khả năng sản phẩm sẽ xuất hiện vào mùa thu năm nay cùng lúc với iPhone 6s và iPhone 6s Plus. Cách đây vài hôm chúng ta cũng được nghe rằng Apple sẽ ra mắt tới 3 mẫu smartphone trong năm nay, bao gồm cả chiếc 6c.\n\n\n \n \n  \n\nCụm đèn flash đơn trên iPhone 5c cũng đã được thay bằng flash kép trên iPhone 6c​\nNguồn: Future Supplier​\n\n\n       "
design	8e06d0a18586cdbe74ba6d2843f4c3d	https://tinhte.vn/threads/day-co-phai-la-mat-sau-iphone-moi-camera-kep-loi-to-co-ho-tro-smart-connector.2561724/	Sau ảnh render thì bây giờ chúng ta có một cái nhìn thực tế hơn về mặt sau của chiếc iPhone thế hệ kế tiếp. Điểm nhấn của tấm hình này chính là cụm camera kép, lồi lên và chiếm riêng một diện tích khá lớn - người ta cho rằng camera kép sẽ chỉ có trên iPhone 7 Plus. Thậm chí là cụm camera này có vẻ như còn lồi nhiều hơn cả camera trên iPhone 6s hiện tại. Theo tin đồn, camera này được sản xuất bởi Sony và cùng có độ phân giải 12 MP. Nguồn tin còn cho biết một ống kính tích hợp hệ thống chống rung quang học và ống còn lại thì có khả năng zoom quang từ 2 đến 3X.\n\nNgoài ra, còn một chi tiết khác khá thú vị đó là ba chấu kết nối ở phía dưới, có thể sẽ phục vụ cho chức năng Smart Connector chăng?\n\nCác điểm khác vẫn tương tự như ảnh rò rỉ trước, đó là đường nhựa ăng-ten đã được làm lại tinh tế hơn, chuyển thành dạng bo cong ôm lấy phần viền đỉnh và đáy máy. Không rõ mặt trước của máy sẽ như thế nào, nhưng về tổng thể thì có vẻ như iPhone mới dường như không có nhiều điểm đột phá về thiết kế.\n\n\n \n \n  \n​\n\n \n \n  \n​Ảnh dựng lại bởi một nhà thiết kế dựa vào các tin rò rỉ\n\n\n \n \n  \n​Ảnh dựng lại bởi một nhà thiết kế dựa vào các tin rò rỉ\n\n\nTheo MacRumors​\n\n\n       
design	889ad559a1b680c6381ab59dc44839d	https://tinhte.vn/threads/day-la-ban-ve-iphone-8-cam-bien-van-tay-sau-lung-cum-camera-xoay-doc-kich-thuoc-gon-hon-7-plus.2692948/	"Tài khoản Twitter Sonny Dickson vừa đăng một tấm ảnh có thể là bản vẽ kĩ thuật của iPhone 8 với mã hiệu ""AL-K702"". Dựa trên hình này chúng ta có thể thấy dường như iPhone 8 sẽ mang cảm biến vân tay ra mặt sau theo kiểu LG hay Pixel, có điều hơi thấp nên không biết là có tiện để tay chạm tới hay không. Có tin đồn mặt trước của máy sẽ sử dụng màn hình viền rất mỏng nên việc di chuyển vị trí cảm biến vân tay là điều có thể hiểu (trước đây còn có tin đồn cảm biến sẽ được tích hợp vào trong hoặc dưới màn hình nữa). Chúng ta cũng thấy được rằng iPhone 8 sẽ xoay dọc cụm camera, chưa biết vì sao Apple lại làm như thế. \n\nKích thước của điện thoại theo bản vẽ này là 149.5 x 72.5mm. Để bạn dễ so sánh thì iPhone 7 hiện là 138.3 x 67.1mm, iPhone 7 Plus là 158.2 x 77.9mm, như vậy iPhone 8 sẽ nằm giữa giữa hai chiếc này nhưng màn hình có thể lớn hơn, 5,7"" chẳng hạn, do viền mỏng kéo theo kích thước tổng quan giảm xuống.\n\nMột số chi tiết còn có thể nhìn được đó là khe SIM và nút nguồn vẫn ở vị trí cũ, bên hông vẫn giữ lại cần gạt chuyển chế độ rung, phía dưới là cổng Lightning. Dựa theo chiều dày của cổng Lightning và bản vẽ, có vẻ như iPhone 8 sẽ mỏng hơn iPhone 7 nữa (hiện đang là 7.1mm).\n\nAnh em nghĩ sao nếu iPhone 8 sẽ trông như thế này? Dù sao thì chúng ta cũng nên cẩn thận, đây chỉ mới là tin rò rỉ thôi nhé.\n\nNguồn: Twitter​\n\n\n       "
design	23862591c156570450b8870f144b16d	https://tinhte.vn/threads/day-la-mo-hinh-iphone-8-voi-mat-truoc-sau-bang-kinh-khung-kim-loai-camera-kep-xoay-doc.2693728/	"Anh chàng Benjamin Geskin vừa đăng lên Twitter một số tấm hình được cho là máy mô hình (dummy) của iPhone 8. Mô hình này, theo Foxconn, được CNC từ một khối vật liệu ra. Ở phía sau lưng không còn là kim loại nữa mà là mặt kính 2,5D gợi nhớ lại iPhone 4, cụm camera kép cũng được xoay dọc lại thay vì đặt ngang như iPhone 7 Plus. Khung viền kim loại xung quanh khá bóng bẩy và có màu bạc theo kiểu iPhone 3G hồi trước. Ở mặt trước dường như không có phím home, khớp với tin đồn rằng iPhone 8 sẽ sử dụng màn hình tràn ra sát viền mỏng (4mm) và cũng được thiết kế kiểu 2,5D. \n\nNgoài ra máy ảnh trước cũng chuyển thành camera kép, chưa rõ ý đồ của Apple là gì, có thể là chức năng nhận diện 3D, nhận diện gương mặt chẳng hạn (vì hai cảm biến thì sẽ nhận biết được chiều sâu của vật thể nên phát hiện các đường nét tốt hơn). Trong khi đó, iOS 11 được Geskin tiết lộ là sẽ ""đơn giản hơn, có nhiều góc bo hơn và thiết kế mới"" để phù hợp với iPhone 8.\n\n\n\n\n\n\n​\nNguồn: Twitter​\n "
design	ce3a8f05088aaa372c7bdb450dcda8c	https://tinhte.vn/threads/day-la-mat-truoc-cua-iphone-moi-nut-home-va-touch-id-duoc-tich-hop-len-man-hinh.2563491/	Trước đến giờ thì chúng ta mới chỉ xem lưng, còn bây giờ thì có vẻ như mặt trước của iPhone thế hệ mới cũng đã xuất hiện. Điểm bất ngờ nhất đó chính là sự thiếu vắng của nút Home vật lý truyền thống, theo nguồn tin thì nút Home và cảm biến Touch ID đã được tích hợp lên màn hình luôn. Mục đích chính đó là giúp tiết kiệm một phần diện tích dư thừa của iPhone. Bên cạnh đó, chúng ta cũng không còn thấy jack cắm tai nghe 3,5mm - đúng như nhiều tin đồn gần đây.\n\nCác chi tiết khác như camera kép, đường ăng-ten được làm lại, chấu Smart Connector vẫn như vậy, không có gì mới lạ so với các hình ảnh rò rỉ trước. Tuy nhiên, cá nhân mình vẫn thấy việc loại bỏ nút Home vật lý và đưa nó cùng Touch ID thành phím ảo vẫn cần được xác thực thêm, bởi nếu thay đổi như vậy thì Apple thực sự có một quyết định rất lớn: tốt là phần trên và dưới của máy sẽ được thu gọn phần nào, nhưng cũng có mặt trái đó là mất đi cảm giác nút bấm Home đã trở thành điều gì đó rất iPhone, rất Apple trong nhiều năm qua.\n\n\n \n \n  \n​\n\n \n \n  \n​\nTheo AppleInsider​\n\n\n       
design	8c74889067943fd7d8eb7a3e235d05d	https://tinhte.vn/threads/hinh-anh-day-co-phai-la-mo-hinh-cua-ipad-air-moi.2371061/	Mình vừa mượn được ở Fonebox.vn một mô hình thiết bị được cho là iPad Air 2, chiếc iPad Air thế hệ tiếp theo. iPad Air mô hình này được Fonebox nhập về cùng chỗ với chiếc iPhone 6 nhái trước kia nên khả năng tin cậy là rất cao. Mô hình này thì được dùng làm bao da, phụ kiện và chúng ta cũng chưa có gì chắc chắn Apple sẽ tiếp tục sử dụng thiết kế như vậy cho iPad Air, nhất là khi họ đã làm iPhone cong và bầu hơn.\n\n\n \n \n  \n Điểm khác biệt dễ thấy nhất của mô hình này năm ở mặt trước với nút home cảm ứng vân tay như kiểu iPhone\n \n \n  \n Camera và cảm biến ánh sáng?\n \n \n  \n Ở góc này thì viền có vẻ cũng được bo cong\n \n \n  \n Nút home mà nhiều người mong chờ đây, có thể trên iPad, nút Home sẽ có nhiều chức năng hơn so với iPhone\n \n \n  \n iPad Air mới được đồn đại là sẽ mỏng 7mm\n \n \n  \n Phần này thì thiết kế không có khác biệt so với bản cũ\n \n \n  \n \n \n \n  \n \n \n \n  \n Nhưng ở cạnh phải chúng ta thấy rõ ràng không còn nút im lặng nữa mà là một lỗ mới, có vẻ như lỗ microphone?\n\n \n \n  \nCận cảnh hơn một chút\n\n \n \n  \n Mặt sau nhìn khá lạ\n \n \n  \n \n \n \n  \n camera chưa có \n \n \n  \n \n \n \n  \n ​\n\n\n       
design	204ddc8937d7d14b9fafa1b19ac1f9e	https://tinhte.vn/threads/hinh-anh-mo-hinh-iphone-5c-du-mau.2163128/	iPhone 5C được cho là sẽ có rất nhiều màu sắc khác nhau, giống với iPod touch hiện tại. Sau khi các anh ở phukiengiare.vn đưa về những mô hình iPhone 5S và 5C đầu tiên thì bây giờ họ lại cho chúng ta xem những chiếc iPhone 5C nhiều màu sắc khác. Hiện tại thì mình đang có mô hình iPhone 5C màu đen, trắng, vàng, hồng, xanh chuối và xanh dương. Ngoài ra thì có thể chúng ta sẽ có màu xanh hay đỏ nữa.... Màu sắc của những chiếc iPhone 5C chính thức sẽ gần như không khác biệt với những màu mà bạn thấy ở đây. Ngoài trừ chiếc 5C màu đen khá bóng thì các sản phẩm còn lại không bị phản chiếu nhiều, mặt trước máy đen cũng đen còn các máy còn lại trắng.\n\n\n\n\n\n\n\n\n\n\n\n\n \nCảm ơn phukiengiare.vn đã hỗ trợ Tinhte.vn\n\n\n       
design	459e88f83ded57fb0e8b7cf8a25795f	https://tinhte.vn/threads/hinh-anh-mo-hinh-iphone-5s-va-5c-xuat-hien-cong-lightning-moi.2152986/	View attachment 1244783\n​ \nChúng ta đã nghe rất nhiều tin đồn về iPhone 5S, chiếc iPhone kế thừa iPhone 5 cùng iPhone 5C, chiếc iPhone giá thấp nhưng vẫn chưa có một hình ảnh nào thật sự rõ nét về chúng. Mình vừa nhận được 2 mô hình (mock up) iPhone 5S và iPhone 5C từ các bạn ở phukiengiare.vn. Đây là công ty đã từng cho Tinhte.vn mượn một mock up của iPad mini khi sản phẩm này chưa xuất hiện trên thị trường nên chúng ta hoàn toàn có thể tin tưởng vào độ xác thực của chúng. Được biết mô hình do đối tác của phukiengiare từ Trung Quốc cho mượn để làm bao da.\n\niPhone 5S:\nTheo tin đồn thì iPhone 5S sẽ là bản nâng cấp nhẹ từ iPhone 5, giống với truyền thống 4S và 4 của Apple. Đối tác phukiengiare cho biết iPhone 5S sẽ có camera 12MP và 2GB, chưa rõ CPU.\n\n\nView attachment 1244737\n​ \nVề thiết kế, như bạn thấy trong các hình ảnh mình chụp hình iPhone 5S không khác gì 5 cả, ngoại trừ cụm camera phía sau. Quan sát ta thấy rõ cụm ống kính 5S nhỏ hơn và đèn flash thiết kế khác. Ngay trong ngày hôm qua thì một nhà sản xuất phụ kiện lớn nhất của Nhật cũng đã xác nhận với mình iPhone 5S sẽ chỉ khác iPhone 5 về cụm camera.\n\niPhone 5C:\n\nView attachment 1244739\n​ ​Đây là chiếc máy giá thấp hơn và nó được làm từ nhựa 100%, giống iPhone 3GS. Mình thấy mô hình iPhone 5C có kích cỡ gần như y hệt iPhone 5, các góc được bo tròn hơn, vỏ không trơn mà hơi sần nhẹ. Đáng chú ý là các phím bấm làm từ nhựa, không phải kim loại. Điểm khác biệt lớn nhất đến từ đáy máy, ta thấy 2 con ốc to hơn, loa khoét lớn và ít lỗ hơn. Đáng chú ý, cảm biến bên cạnh micro thoại của iPhone 5 không xuất hiện trên iPhone 5C, chỉ còn camera phụ. Microphone phụ nằm cạnh camera cũng đã chuyển thành hình tròn chứ không dẹp (iPhone 5S cũng vậy).\n\nCổng kết nối mới?\n\nView attachment 1244761\n​ ​Có một điểm rất lạ là mô hình iPhone 5C sử dụng một chân giao tiếp mới nhỏ hơn Lightning hiện tại. Nếu để ý bạn sẽ thấy bên trong Lightning trên iPhone 5 rỗng hoàn toàn, các mạch tiếp xúc trên sợi cáp hoàn toàn lộ ra ngoài trong khi mô hình cho thấy sợi cáp mới sẽ có thiết kế gần giống microUSB hơn, tức sẽ có một thanh nhỏ nằm ở bên trong của cổng trên thiết bị. Sợi cáp mới sẽ giấu các mạch tiếp xúc vào bên trong (bạn có thể nhìn vào cáp microUSB cho dễ hình dung).\n\nNếu Apple thay cáp thật thì đây là một động thái hoàn toàn bất ngờ của hãng. Mình không nghĩ họ lại làm điều này trong thời gian ngắn sắp tới. Hãy cùng chờ xem.\n\n\nView attachment 1244766\n​ \nMô hình iPhone 5S không có thiết kế cổng lạ như iPhone 5C nhưng nó lại nhỏ hơn Lightinng và có kích cỡ y hệt 5C. Không rõ đây là do mock up nên nhà sản xuất làm thiếu hay Apple đang nghiên cứu nhiều loại cổng khác nhau.\n\niPhone 5S và iPhone 5:\n\n\n\n\niPhone 5C và iPhone 5:\n\n\n\n\niPhone 5C, iPhone 5S và iPhone 5\n\n\n\n\nCảm ơn phukiengiare.vn đã hỗ trợ Tinhte.vn thực hiện bài viết này.\n 
design	635bbf7bdc77a7e9bb288489f0099b1	https://tinhte.vn/threads/hinh-anh-mo-hinh-thu-nghiem-iphone-6-chup-voi-mo-hinh-s5-va-5s.2294578/	"Trang Macitynet.it vừa đăng hình ảnh chụp mẫu thử nghiệm (mockup) của chiếc iPhone 6 màn hình 4""7. Có cả hình chụp cạnh chiếc máy dùng cho việc trưng bày (dummy) của chiếc Galaxy S5 và iPhone 5s. Qua đây chúng ta có thể suy ra một ít thông tin về chiếc iPhone 6. Mặt kính trước được bo ở các cạnh, đường bo có vẻ gấp hơn là của những máy Lumia vốn cũng được bo ở cạnh. Sườn của máy được bo tròn tương tự như cách Apple làm iPad mini chứ không thẳng như hiện nay. Mặt sau lưng thì cũng chia ra làm ba phần như là ở các đời iPhone trước. Hệ thống nút chỉnh âm thanh mới, nút khóa mở màn hình được đặt ở cạnh phải trên của máy. So với kích thước thì iPhone 6 nhỏ hơn và mỏng hơn Galaxy S5, mỏng hơn nhưng lớn hơn so với iPhone 5s.\n\n\n\n\n\n\n\n\n\n\n\n\n\n\nTheo Macitynet.it và Mactitynet.it​\n\n\n       "
design	f9bd500214b6b458201963492d9548e	https://tinhte.vn/threads/lo-dien-mo-hinh-iphone-6-voi-man-hinh-lon-vien-rat-mong.2275051/	"​Trang Bling My Thing mới đây đã cho đăng tải hai tấm ảnh về một mô hình ""iPhone 6"", và như hình trên thì chúng ta có thể thấy rằng nó lớn hơn khá nhiều so với iPhone 5s hiện tại. Ảnh này khớp với những tin rò rỉ trước đây rằng iPhone thế hệ mới có thể sẽ dùng hai loại kích thước màn hình là 4,7"" và 5,5"". Viền màn hình của mẫu iPhone 6 này rất mỏng, những chi tiết khác như các góc bo tròn, camera trước, nút Home thì không có nhiều điểm khác biệt so với các smartphone hiện nay của Apple. Ở mặt sau thì chúng ta có một camera và một đèn flash LED (hơi lạ vì iPhone 5s có đến hai đèn flash, trong khi ở đây chủ có một).\n\nĐược biết Bling My Thing là công ty chuyên sản xuất phụ kiện và vỏ dành cho smartphone được thành lập bởi một nhà thiết kế người Nhật. Việc một hãng phụ kiện rò rỉ tin tức và hình ảnh về iPhone mới không còn là một điều quá mới lạ bởi trước đây iPhone 5s và 5c cũng từng lộ diện bởi rất nhiều đơn vị hoạt động trong lĩnh vực này. Tinh tế sẽ tiếp tục chuyển đến bạn những thông tin mới nhất về iPhone 6 trong thời gian tới.\n\nTin đồn về iPhone 6 mà chúng ta đã biết:\n\nHai loại kích thước màn hình: 4,7"" và 5,5""\n\nMặt kính sapphire\nMật độ điểm ảnh 441ppi, cao hơn mức 326ppi hiện nay\nMáy ảnh 8 megapixel, hỗ trợ chống rung quang học, khẩu độ f/1.8 (hiện nay là f/2.2)\n\n \n \n  \n​Nguồn: Bling My Thing​\n\n\n       "
design	f8c12f334d582c35781746852acb9f8	https://tinhte.vn/threads/lo-dien-mat-sau-ipad-mini-2-voi-logo-kieu-moi.2148527/	​ \nMới đây trên mạng Internet xuất hiện một số hình ảnh được cho là mặt sau của chiếc iPad mini thế hệ 2 sắp được Apple ra mắt. Theo đó, phần mặt lưng của iPad thế hệ mới tiếp tục được chế tạo từ nhôm nguyên khối với các góc bo tròn, lỗ loa và cổng Lighting giống iPad mini hiện tại nhưng logo dập ở mặt sau được thiết kế lại. Trên thế hệ iPad mini hiện tại, logo quả táo được dập chìm mạ crom sáng bóng trên bản màu trắng, trong khi logo Apple trên iPad mini màu đen in mờ hơn. Ở hình ảnh rò rỉ này, có thể thấy logo được dập chìm dưới lớp nhôm và mạ đen, không rõ có phải đen bóng giống trên iPad lớn không. Dù hình ảnh này được chắc chắn là từ Apple nhưng không thể loại trừ khả năng nó là nguyên mẫu hoặc bản thử nghiệm nào đó. Nếu hình ảnh trên là chính xác thì iPad mini mới sẽ không thay đổi về thiết kế mà có thể sẽ là màn hình Retina độ phân giải cao hơn. iPad lớn thế hệ 5 có thể sẽ có thiết kế giống iPad mini hiện tại.\n \n\n \n \n  \n​ \nNguồn: Cult of Mac​\n\n\n       
design	33c8599dffc9993493a9096910720e5	https://tinhte.vn/threads/moi-xem-video-mo-hinh-3d-cua-iphone-7-va-7-plus.2583636/	​\nHôm qua chúng ta thấy bản vẽ của iPhone 7 và iPhone 7 Plus (hoặc 7 Pro), còn hôm nay là một video 3D được dựng nên dựa trên bản vẽ đó. Tương tự như tin rò rỉ hôm qua, camera kép chỉ xuất hiện trên chiếc 7 Plus mà thôi, trong khi iPhone 7 thường chỉ sử dụng camera đơn nhưng có vẻ như kích thước to hơn iPhone 6(s) hiện tại. Cũng liên quan tới máy ảnh của iPhone, trước đây nhà phân tích Ming-Chi Kuo tiết lộ rằng chỉ có bản iPhone 7 Plus dòng cao 128GB mới sở hữu camera kép. Tuy nhiên, với phản hồi tích cực của người dùng về LG G5 và Huawei P9, Apple đã thay đổi quyết định và sẽ đem hệ thống quang học này lên tất cả mọi phiên bản iPhone 7 Plus. Ông cũng chia sẻ thêm rằng iPhone 7 Plus nhiều khả năng sẽ có RAM 3GB.\n\nCả hai thiết bị này đều không sử dụng jack tai nghe 3,5mm truyền thống, thay vào đó Apple sẽ khuyến khích xài tai Bluetooth hoặc dùng cổng Lightning. Nhìn tổng quan, ngoại hình của máy không khác nhiều so với iPhone hiện tại. Cuối cùng, iPhone 7 và 7 Plus sẽ sở hữu cổng Smart Connect để kết nối với các phụ kiện ngoài, có thể là case pin hay vỏ bàn phím nào đó chẳng hạn.\n\nNguồn: uSwitch, 9to5Mac​\n\n\n       
design	992302e333f47addd552fe09a4593c4	https://tinhte.vn/threads/moi-xem-video-tren-tay-mo-hinh-hai-chiec-iphone-7-va-iphone-7-plus.2634969/	Một anh chàng ở Anh đã có dịp trên tay mô hình iPhone 7 và iPhone 7 Plus để cho chúng ta xem những hình ảnh rất rõ ràng về chiếc điện thoại này. Cả hai chiếc mà anh này trên tay đều có màu Rose Gold, và chúng chẳng khác gì so với những tin rò rỉ mà chúng ta đã nghe ngoại trừ việc không có cổng Smart Connector. Có 2 khả năng: hoặc Apple quyết định bỏ luôn cổng này so với bản thử nghiệm, hoặc chỉ đơn giản là mô hình không có nhưng bản chính thức sẽ có. Mời anh em xem qua hai video bên dưới nhé, cái thứ hai là so sánh iPhone 7 với iPhone 6s đang bán.\n\n\n\n\n\n\n       
