design	80e2e12aafb29ec2c9fea8196b7bec0	https://tinhte.vn/threads/blackberry-chia-se-ve-qua-trinh-thiet-ke-priv-su-hoa-hop-giua-full-touch-va-ban-phim-cung.2532343/	"BlackBerry vừa đăng tải lên blog của mình đoạn nói chuyện với Michael DeFazio, trưởng nhóm thiết kế công nghiệp của công ty, về quá trình làm ra chiếc Priv. Qua đây bạn sẽ biết được về những mục tiêu mà BlackBerry đặt ra cho Priv, làm thế nào hãng biết chúng thành hiện thực, cũng như đánh giá của DeFazio về cách mà người ta sẽ tiếp cận với chiếc điện thoại Android đầu tiên của BlackBerry.\n\nNhững triết lý thiết kế nào ảnh hưởng đến Priv?\n\nMichael DeFazio chia sẻ: ""Sự đồng cảm không phải là một triết lý hay cách tiếp cận mới trong ngành thiết kế, tuy nhiên các nhà thiết kế rất dễ quên đi điều đó và chỉ tập trung về tính thẩm mĩ. Chúng tôi chọn phải lắng nghe những gì mà người dùng mong muốn. Về hệ sinh thái, BlackBerry giải quyết vấn đề bằng cách chuyển sang dùng Android cho Priv, như vậy thì người dùng ngay lập tức có được rất nhiều app mà không mất thêm thời gian chờ đợi. Nhóm thiết kế cũng phải tìm cách đem đến bàn phím vật lý mà người dùng yêu thích trong khi không làm hỏng đi trải nghiệm của một thiết bị full-touch. Về máy ảnh, chúng tôi nhận thấy rằng nó rất quan trọng trong cuộc sống ngày nay nên chúng tôi chọn camera 18MP Schneider-Kreuznach.\n\nDeFazio cho biết thêm rằng một trong những thứ mà người dùng rất lo lắng đó là thời lượng pin. ""Pin cho điện thoại thông minh thường không đạt đủ một ngày sử dụng sau một lần sạc, do đó chúng tôi cần viên pin to hơn"". Những việc lắng nghe người dùng này thực chất rất đơn giản, còn thách thức ở đây là tìm ra một cách kết hợp tất cả những thứ đó lại trong một thiết bị duy nhất.\n\n\n \n \n  \n \n\nCảm hứng nào đã khiến BlackBerry tạo ra Priv?\n\nDeFazio nói ngay, đó là cảm hứng từ một thiết bị có bàn phím trượt. Từ trước đến nay rất ít thiết bị Android có bàn phím cứng, do đó ""chúng tôi phải tìm cách tích hợp bàn phím vật lý của chúng tôi vào một thiết bị lớn với màn hình 16:9"". Thế rồi quyết định được đưa ra: giấu bàn phím đó bên dưới, và khi nào cần thì người dùng sẽ trượt xuống để sử dụng. Bằng cách này, BlackBerry sẽ không làm máy trở nên quá to. Đây cũng là một ẩn ý về mặt thiết kế: Priv có nghĩa là Privacy - có nghĩa là sự riêng tư - thế nên bàn phím chỉ xuất hiện khi cần mà thôi.\n\nMục tiêu chủ yếu về mặt thiết kế khi làm ra Priv là gì và làm cách nào BlackBerry đạt được điều đó?\n\nTheo vị trưởng nhóm thiết kế công nghiệp, mục tiêu lớn nhất với Priv là tạo ra một thiết bị có thể mang lại trải nghiệm tốt cho cả thao tác cảm ứng lẫn việc gõ bằng phím cứng, không có sự thỏa hiệp nào được phép xuất hiện. ""Ở trạng thái đóng lại, thiết bị này tương đương với các máy full-touch khác trên thị trường, chúng tôi không muốn hi sinh đi độ mỏng, tính gọn nhẹ, công thái học cũng như thiết kế. Còn ở trạng thái trượt ra, thiết bị này biến thành một thứ dùng để gõ chính xác, thứ đã làm nên danh tiếng của BlackBerry. Tôi tin rằng điều đó có thể được đo lường thông qua sự bất ngờ mà người dùng nhận ra khi họ lần đầu trượt cái máy xuống.""\n\n\n \n \n  \n \n\nNgay cả phần gờ có màu kim loại nằm cuối màn hình cũng được thiết kế một cách chủ ý. BlackBerry đưa chi tiết này vào để tăng tính công thái học, từ đó giúp người dùng dễ trượt máy hơn, và cũng là dấu hiệu để thông báo cho người ta biết Priv có bàn phím trượt.\n\nDeFazio cho biết thứ mà ông thích nhất ở Priv đó là vỏ đỡ cho màn hình. Thành phần này được tạo ra bằng cách lấy phần cấu trúc dùng để hỗ trợ màn hình và tấm kính rồi để lộ nó ra ngoài. Phần cấu trúc đó ở các máy khách hay được giấu đi, còn ở Priv nó được làm lộ ra bên dưới màn hình khi bạn trượt máy lên. ""Chi tiết này làm từ nhôm mà người ta dùng để lắp ráp máy bay, thế nên nó có độ bền, trọng lượng nhẹ, cộng thêm lớp sơn mạ nữa"". Phần vỏ này cũng có chức năng bảo vệ cho màn hình cong của Priv.\n\n\n \n \n  \n \n\nCòn Cortex Corley, một nhà thiết kế công nghiệp khác cũng làm cho BlackBerry, thì nói điều mà ông thích nhất về mặt thiết kế của Priv đó là mặt sau nguyên khối. Phần cong nhẹ kết hợp với lớp hoàn thiện mềm đã khiến Priv trở nên dễ cầm, trong khi đó các lỗ loa và hoa văn kính carbon thì bổ sung những điểm nhấn về thị giác.\n\nTheo các nhà thiết kế, người dùng sẽ thích Priv nhất ở chỗ nào? \n\nDeFazio nghĩ rằng người ta sẽ thích sự kết hợp giữa bàn phím ảo và cứng trong một thiết bị như Priv. ""Bất kì ai từng gõ trên một cái BlackBerry trong quá khứ sẽ tìm được sự quen thuộc, thoải mái và tiện lợi."" Ngoài ra, bàn phím này còn cho phép người ta trượt ngón tay trên nó để xài như touchpad, vốn là công nghệ đã có từ chiếc Passport năm ngoái, từ đó hỗ trợ tốt hơn trong việc gõ bàn phím vì người ta có thể gợi ý nhanh, xóa chữ nhanh cũng như truy cập đến các kí tự đặc biệt. Nó cũng có thể cuộn nội dung lên xuống, phù hợp cho những ai không muốn rờ ngón tay lên màn hình.\n\nÔng còn nghĩ rằng người ta sẽ thích màn hình lớn, đẹp với viền cong vì nó rất bắt mắt. Priv cũng có cung cấp một vài chức năng để người ta khai thác phần cong này.\n\n\n \n \n  \n \n\nPriv chịu ảnh hưởng về mặt kĩ thuật cơ khí ra sao?\n\nDeFazio: ""Các kĩ sư cơ khí của chúng tôi đã đẩy xa giới thiệu của nguyên liệu và quy trình chế tạo để mang lại một trải nghiệm all-touch hoàn hảo kèm theo bàn phím vật lý. Bằng cách dùng những vật liệu như sợi composite thủy tinh, nhóm chúng tôi đã có thể nhét được cục pin 3410mAh vào một chiếc điện thoại trượt với độ mỏng ấn tượng khi so với với các đối thủ full-touch khác."" BlackBerry cũng có nói rằng các kĩ sư của công ty từ mọi bộ phận, cả phần cứng lẫn phần mềm, cũng phải bắt tay làm việc chặt chẽ để cho ra đồi Priv. ""Đảm bảo Android chạy ngon trên BlackBerry là một tác vụ rất nặng nề"".\n\n\n \n \n  \n\n\nThử thách lớn nhất với Priv về mặt thiết kế là gì?\n\nĐó là việc phải cân bằng giữa thiết kế mỏng, đẹp với việc phải đưa cả một bàn phím cứng vào. Điều này khiến quy trình thiết kế Priv phức tạp hơn nhiều so với những chiếc smartphone full-touch khác. ""Nhóm phần cứng, ăng-ten và nhóm cơ khí cũng phải làm việc cùng với nhóm thiết kế để đảm bảo rằng mọi thứ đều nằm đúng vị trí của mình, từ màn hình cong, camera 18MP cho đến các hệ thống ăng-ten phủ khắp máy, trong khi vẫn đảm bảo nhóm thiết kế có thể thoải mái sáng tạo ra một thiết bị đẹp.\n\nBlackBerry cũng phải dành nhiều thời gian để chọn lựa nguyên liệu vì công ty muốn đảm bảo việc phân phối trọng lượng phải cân đối trên cả chiếc máy, nhất là khi người dùng trượt ra. Có như vậy thì mới đảm bảo cảm giác cầm tốt, không bị nghiêng hay lệch và gây ra sự khó chịu.\n\nNguồn: BlackBerry​\n\n\n       "
design	5c2b32ecdc0cff355fca1f6bb8401e3	https://tinhte.vn/threads/blackberry-gioi-thieu-video-cau-chuyen-thiet-ke-passport.2363484/	Không cần laptop, có thể làm việc nguyên ngày, đó là thiết bị của những người chuyên nghiệp, đó là chiếc máy thời trang, BlackBerry là trùm cuối trong việc làm bàn phím cứng, chỗ tách ăng ten ngay cổng kết nối không cần khớp (như iPhone chẳng hạn)... đó là những thông điệp mà mình thấy được trong video câu chuyện thiết kế Passport của BlackBerry. So với tất cả các máy trên thị trường thì Passport hoàn toàn lạ với màn hình vuông và bàn phím cứng ở dưới. Tuy nhiên phần để bạn nhận biết một chiếc BlackBerry cao cấp là sự sang trọng, thời trang mà lâu lắm rồi - từ hồi BlackBerry 9900 - giờ mới thấy lại trên một chiếc BlackBerry. \n\nMình có để link video youtube và chụp lại một số hình ảnh trong video. Mời anh em xem qua. \n\n​\n\n\n\n\n\n\n\n\n\n\n\n\n       
design	0be27bed336862b8e8a3d057133f5ae	https://tinhte.vn/threads/chat-bb-tren-priv-thiet-ke-ban-phim-phim-tat-tim-kiem-holster.2528435/	Chất bê bê, đó là cái mà anh em quan tâm mỗi khi BlackBerry giới thiệu một chiếc điện thoại mới. Và với Priv thì điều đó lại được quan tâm hơn vì BlackBerry chạy một hệ điều hành không phải do họ phát triển và đang ở dạng trăm hoa đua nở trên thị trường. Qua hai ngày sử dụng thì mình xin xác nhận với anh em là những gì thuộc về chất của BlackBerry vẫn còn đó trên Priv và thậm chí là còn tốt hơn là trên các máy BlackBerry chạy BB10. Điều duy nhất đáng tiếc là holster chưa hoạt động hết tính năng.\n\n​\nThiết kế\nCho dù tình hình kinh doanh có khó khăn đi rất nhiều nhưng BlackBerry vẫn giữ được phong cách của mình  trong thiết kế. Điện thoại họ làm ra vẫn mang phong cách riêng, đặc trưng, không lẫn. Vẻ đẹp của điện thoại BlackBerry mạnh mẽ, nam tính, sang trọng và lịch lãm. Chẳng cần phải siêu mỏng, siêu nhẹ, camera không lồi hay nhôm nguyên khối... Priv vẫn đẹp và lịch lãm, vẫn mang cái riêng.\n\n\n \n \n  \n\n\nBàn phím cứng\nBàn phím của BlackBerry vô đối cách đây 10 năm và bây giờ nó vẫn thế. Priv có một bàn phím có thể nói là tốt nhất trong các máy BlackBerry mình từng sử dụng. Nó có thiết kế 4 hàng, khoảng cách ngắn tương tự như 9900 nhưng lại có sự mềm mại như là Passport Silver. Nếu muốn so sánh một chút với những chiếc Android khác thì anh em có thể liên tưởng đến chiếc HTC Cha Cha hay chiếc phụ kiện bàn phím mà  Samsung gần đây làm cho S6 Edge Plus.\n\n\n \n \n  \n\n\nPhím tắt: Speed Dial\nKể chuyện cũ. Năm 2010 mình có tham dự một hội thảo ở một khách sạn 5 sao ở Singapore. Âm thanh mình nghe nhiều nhất ở đó, từ thang máy đến đại sảnh, phòng họp... là âm thanh speed dial của BlackBerry. Chuyện ít cũ hơn là lần đầu tiên mình cầm Q10 trên tay mình thử ngay tính năng speed dial và nó không có (cái này mình trên tay rất sớm, sau này anh em dùng thì có), lúc đó chỉ muốn vứt nó đi ngay. Priv có speed dial.\n\n\n \n \n  \n\n\nTìm kiếm nhanh: \nKhi ở màn hình chính và nhất bàn phím thì tự động tìm nội dung trên máy rất nhanh. Trước đây trên BlackBerry OS7 chúng ta gọi là Universal Search. So với tìm kiếm trên Android tìm kiếm này trên máy nhanh hơn nhiều và cũng nhanh hơn và sắp xếp thông minh hơn trên iOS. Lý do là tìm trên BlackBerry chủ yếu là tìm trong máy, offline và tập trung vào danh bạ, email.\n\n\n \n \n  \n\n\nBlackBerry Hub\nNơi tập trung tất cả các thông báo: điện thoại, tin nhắn, email, facebook, lịch, twitter... Anh em dễ dàng theo dõi và quản lý hơn so với việc quản lý từng ứng dụng riêng biệt. Ở Priv bạn có thể truy cập nhanh vào Hub bằng cách vuốt từ nút home ảo vòng qua hướng bên phải màn hình.\n\n\n \n \n  \n\n\nHolster\nTuy không còn nhiều tính năng nhưng chúng ta vẫn trải nghiệm được phần nào đặc trưng này của BlackBerry trên Priv. Cứ dùng xong điện thoại là nhét vào bao, không cần quan tâm đến nó đang ở trạng thái nào.\n\nĐèn LED thông báo:\nVẫn còn đó và có thể chỉnh màu khác nhau cho từng ứng dụng. Xin lỗi vì trong video mình không đề cập đến cái này. Mặc định sẽ là đèn trắng thay vì đỏ.\n\nNgoài ra còn có hệ thống các ứng dụng của BlackBerry như Password Keeper, máy tính, lịch, nhiệm vụ (task), ghi chú, biểu tượng notification... tất cả cho chúng ta cảm giác như là dùng một chiếc BlackBerry thực sự và khác biệt so với các máy Android khác.\n\n\n \n \n  \n\nBiểu tượng Notification truyền thông của BlackBerry.\n\nTrên đây là những gì mình nghĩ mang chất BlackBerry mà mình muốn chia sẻ với anh em. Mình sẽ sử dụng thêm và chia sẻ với anh em thêm về những cái được và chưa được của Priv. \n\nHình ảnh \n\n\n\n\n\n\n\n\n\n\n\n       
design	fabc2f0c34091e345d68b15e79d4548	https://tinhte.vn/threads/chia-se-cam-nhan-thiet-ke-cua-passport-silver-lai-them-mot-lan-rung-dong.2511708/	"Hồi cuối năm ngoái mình sắm một con BlackBerry Passport về dùng như là một điện thoại chính và mình đã thật sự bị cuốn hút bởi vẻ ngoại độc đáo của máy, thế nhưng ẩn chứa trong đó vẫn còn chút gì chưa hài lòng lắm về mặt thiết kế. Máy vẫn còn hơi thô, trong khi mình thích thứ gì đó phải thật sexy, thật hiện đại, trong khi vẫn phải đảm bảo là không bị hòa lẫn với những chiếc smartphone khác trên thị trường. May sao năm nay lại có Passport Silver Edition, và mình đã  bị ""rung động"" thêm một lần nữa vì hầu hết những điểm hạn chế nói trên đều đã được khắc phục. Trước mặt mình là một chiếc BlackBerry hấp dẫn nhất mà mình từng xài qua.\n\nGhi chú: Đây không phải bài đánh giá chi tiết, mình chỉ chia sẻ vài trải nghiệm của mình về ngoại hình của Passport Silver và các điểm tốt cũng như chưa tốt trong thiết kế. Mình cũng có vài chỗ so sánh với Passport đời trước. Chi tiết về camera, phần mềm, hiệu năng, pin… sẽ được mình nói tới trong một bài review kĩ hơn.\n\nNhìn vào PP Silver thì điểm khác biệt đầu tiên mà bạn có thể nhận ra đó là phần khung kim loại của máy phủ gần hết mặt trước của thiết bị. Trong khi đó, Passport bản thường chỉ có viền kim loại chạy bao xung quanh 4 cạnh mà thôi. Điều này khiến PP Silver mang dáng vẻ hiện đại hơn, cao cấp hơn so với người tiền nhiệm của mình. Anh em lưu ý, mình nói như vậy không có nghĩa là Passport nhìn không sang, chỉ là ở bản Silver thì BlackBerry đã nâng nó lên một tầm cao hơn, và mặc cho cấu hình bên trong giữ nguyên nhưng chúng ta hoàn toàn có thể xem PP Silver như một đời thứ 1,5 của PP vậy (chưa hẵn là đời 2, tại cấu hình chưa được nâng cấp mà).\n\n​\nCó thể bạn sẽ nói rằng so với PP cũ thì PP Silver dường như bị chia cắt nhiều hơn ở mặt trước. Điều này không sai, có điều nó KHÔNG làm cho mặt trước của máy trở nên xấu đi. Lúc trước PP bản đen hay trắng đều dùng khung nhựa đồng màu, tức là nguyên mặt trước trừ màn hình ra thì màu trắng hoặc đen là chủ đạo, còn với PP Silver thì ngoài đen còn có thêm  bạc kim loại. Tuy nhiên, đội ngũ thiết kế của BlackBerry đã rất khéo léo làm cho những phần bạc này trở nên mảnh đi và liền lạc với phần còn lại của thiết bị. Ví dụ, các đường viền ngăn bàn phím giờ đây trở nên hòa hợp và nối liền vào phần khung một cách liên tục, không còn các đường cắt thô như PP cũ. Hay như phần cạnh trên, nó được vát kim cương liền xuống khung luôn chứ không tách thành 2 mảng riêng như người tiền nhiệm.\n\n​\nMình cũng rất thích cách mà BlackBerry làm loa thoại cho Silver. Thay vì một mảng bạc lạc lõng như trước thì PP Silver dùng một loạt các lỗ được đục thẳng lên vỏ nhôm để thoát âm, và các lỗ này cũng rất tinh xảo chứ không bị thô. Các bạn có thể không tin chứ mình đã dành hẳn 5 phút trên máy bay hôm mình đi chơi Đà Nẵng chỉ đề nhìn chằm chằm vào cái loa thoại này cho đã. Lần gần nhất mình nhìn chằm chằm vào loa thoại là khi mình xài HTC One M8 vốn cũng có cách làm speakerphone y như PP Silver.\n\nChuyển sang phần viền, các bạn có thể thấy là 4 góc của PP đời trước đều sắc và góc cạnh, còn trên PP Silver thì 2 góc dưới được bo lại cho mềm mại hơn một chút. Điều này không hề làm giảm đi tính mạnh mẽ của thiết bị, mà trái lại còn góp phần tăng thêm vẻ bắt mắt cho sản phẩm. Bạn có thể tưởng tượng PP Silver giống như hình chữ U, còn PP trước thì như một hình vuông đúng nghĩa. Ngoài tác dụng về ngoại hình, việc bo góc như thế này còn góp phần giúp PP Silver đỡ bị cấn vào đùi chúng ta hơn khi bỏ vào trong túi quần, nhất là khi ngồi. Đây cũng là một trong những điểm khó chịu của PP và PP Silver đã khắc phục được.\n\n​\nNhư mod @sonlazio đã nói, do phần viền trên PP Silver được vát xéo mềm mại cộng với 2 góc dưới bo tròn nên cảm giác cầm sẽ êm hơn, dễ chịu hơn so với PP trước. Bạn chỉ cần vuốt tay ngang qua các cạnh viền là thấy ngay điều này, hoặc khi cầm một tay cũng có cảm nhận tương tự. Điều này cũng góp phần làm cho máy khó bị rơi hơn một chút, nhưng chỉ một chút thôi chứ chưa cải tiến nhiều. Tính đến lúc viết bài này, mình đã xuýt làm rôi PP Silver hai lần, trong đó 1 lần là vừa đi vừa cầm và 1 lần là nằm nghịch máy.\n\nMột điểm rất đáng khen nữa của PP Silver đó là phần cạnh trên và dưới máy đã được làm hoàn thiện và tốt hơn nhiều so với PP cũ. Trước đây hai cạnh này của PP rất rối, ví dụ như cạnh dưới có 3 lỗ loa to khá thô, rồi mảng nhựa của cổng USB, rồi lại có thêm một đường màu kim loại cắt ngang ngay giữa nhìn rất kỳ (mình bình chọn cạnh này là xấu nhất của PP, trên máy màu trắng nhìn còn tệ hơn!). Còn trên PP Silver, do sử dụng khung kim loại liền mạch nên bạn sẽ thấy là những lời phàn nàn trên đã được giải quyết, loa đã chuyển thành dạng đục lỗ tương tự như loa ngoài, đường màu kim loại kia cũng bị loại bỏ đi. Chỉ còn lại một cạnh dưới trơn mượt, đẹp mắt. Điều tương tự cũng áp dụng cho cạnh trên của PP Silver.\n\n​\nQuay sang mặt sau, các vân được làm nhỏ lại hơn và cầm nhám tay hơn, và cá nhân mình cũng thấy là điều đó làm cho PP Silver trở nên sang hơn. Nhưng tâm điểm nổi bật không nằm ở đây, mà là ở cụm camera tròn kết hợp với dải nhựa đồng màu bạc. Trước đây trên PP thì cụm camera có thiết kế vuông vức, không đẹp lắm, nó cũng nhìn chìm và không nổi bật. Còn ở Silver, thiết kế tròn nhìn bắt mắt hơn, nhìn vô mặt lưng là đây chính là điểm hút mắt đầu tiên, và mình cũng đã đưa cho vài người bạn xem thì ai cũng khen cả.\n\n​\nViệc đưa ra thiết kế tròn này cũng giúp bảo vệ bên trong tốt hơn. Ngay bên trên camera là dải nhựa để che khay SIM và thẻ nhớ. Lưu ý là mặc dù nó có cùng màu bạc với phần còn lại của PP Silver nhưng chất liệu lại bằng nhựa, không phải kim loại (nếu chỉ nhìn sơ qua thì khó mà biết được).\n\nMột cải tiến khác rất đáng yêu của PP Silver đó là bàn phím. Bàn phím của máy giờ đây làm mềm hơn khá nhiều so với hồi PP cũ, bấm êm và nhẹ nhàng hơn rất nhiều. Còn nhớ hồi trước dùng PP, mình đã phải dành nhiều sức lực chỉ để nhấn vào bàn phím này  còn bây giờ thì vừa nhấn vào là đã thấy “sướng” và “đã” hơn nhiều lần. Thực chất thì chuyện phím mềm hơn này với mình rất quan trọng, bởi mình vốn quen sử dụng máy cảm ứng nên không phải bỏ nhiều lực ra để nhập liệu, còn lên các máy BB với bàn phím cứng nên mình phải ấn mạnh hơn. Anh em dùng BB quen thì có lẽ sẽ không gặp vấn đề gì. Bàn phím nhẹ nhàng hơn cũng sẽ giúp mình gõ nhanh hơn, chính xác hơn và đỡ ồn ào hơn.\n\nThao tác vuốt ngang dọc để cuộn nội dung trực tiếp trên bàn phím vẫn còn được duy trì từ PP sang PP Silver, tuy nhiên do phím được làm cạn hơn một chút nên vuốt nhẹ hơn, thích hơn, không còn cảm giác hơi vướng tay như trước nữa.\n\n​\nNãy giờ khen nhiều rồi, giờ đến lúc chê. Ngay khi nhìn vào máy thì bạn có thể thấy khá rõ đường nối giữa phần bàn phím với màn hình, nó là một lằn đen to làm mất đi tính liền mạch của mặt trước. Mình không rõ vì sao BB lại để chi tiết này lộ rõ ra, có lẽ do nguyên nhân chế tác cơ khí nào đó. Nhưng dù gì đi nữa thì đây là điểm trừ rất lớn vì nó làm “tổn hại” đến một thiết kế tuyệt vời. Phần vỏ kim loại ráp giữa bàn phím với khung nhôm cũng không phải nguyên ngối mà là hai mảng tách ra, nhưng phần này thì không bị đường nối đen nên không vấn đề gì.\n\n\n \n \n  \n\n\nỞ phía sau lưng PP cũ cũng như PP Silver có một cái nắp nhựa, chúng ta có thể nạy nó ra để nhét SIM và thẻ nhớ. Và cũng vì cơ chế gỡ ra, tháo vào như vậy nên lại có thêm đường nối giữa nắp đó với mặt lưng, không đẹp tí nào. Trên PP cũ màu đen thì đường này tiệp màu với mày nên mình không để ý, chứ trên PP Silver thì nó hiện ra rất rõ trên nền bạc kim loại. Mình hi vọng rằng năm sau BB sẽ cân nhắc đến chuyện làm khay SIM và khay thẻ nhớ lại tích hợp trên thân máy, giống như iPhone, Galaxy S6, Note 5 hay HTC One M-Series. Như vậy thì mấy cái đường đen kiểu như thế này sẽ ít “đất sống” hơn do không có thành phần tháo ráp.\n\n\n \n \n  \n\n\nCuối cùng là đèn LED ở mặt trước. Đèn LED đã luôn là đặc điểm nhận diện của các máy BB rồi, nhưng trên PP Silver thì lỗ đèn LED là một cục đen to tròn nằm nổi bật lên trên nền khung nhôm xám. Lỗ này làm cho phần trên cùng của PP Silver bị rối, do gần đó đã có một cục đen của cảm biến ánh sáng / tiệm cận, và một cục nữa dành cho camera trước. Mình thấy HTC họ làm đèn LED ẩn bên dưới loa thoại rất khéo léo, và ánh sáng sẽ thoát ra chung với lỗ loa luôn. BB có thể cân nhắc biện pháp tương tự cho thế hệ kế tiếp của PP Silver chăng?\n\nTrên đây là những chia sẻ của mình về ngoại hình và bàn phím của PP Silver. Hi vọng nó sẽ giúp anh em biết rõ hơn về thiết bị này để lỡ có yêu thì quyết định mua, còn chưa yêu thì có thể tiếp tục chờ. Bài đánh giá chi tiết PP Silver sẽ có trong thời gian tới, anh em nhớ đón xem nhé.\n\nCám ơn 365mobile.vn đã cho mình mượn máy để làm bài này. \n\n\n       "
